{
  "$schema": "https://json-schema.org/draft/2020-12/schema",
  "$id": "https://opensourcecheck.org/schema/attestation/v0.json",
  "title": "OpenSourceCheck Attestation",
  "description": "One signed record of a single LLM-assisted security-review run over an open-source project at an exact commit. Records what was checked, by which model, with which prompts, and what a human validator concluded. Never asserts that code is 'safe'.",
  "type": "object",
  "additionalProperties": false,
  "required": ["schema", "id", "target", "run", "findings", "verdict", "auditor", "signature"],
  "properties": {
    "schema": {
      "const": "osc-attestation/v0",
      "description": "Schema version identifier. Frozen per major version."
    },
    "id": {
      "type": "string",
      "pattern": "^OSC-[0-9]{4}-[0-9]{4,}$",
      "description": "Registry-unique attestation id, e.g. OSC-2026-0001."
    },
    "target": {
      "type": "object",
      "additionalProperties": false,
      "required": ["repo", "commit"],
      "properties": {
        "repo": {
          "type": "string",
          "format": "uri",
          "description": "Canonical source URL of the audited project."
        },
        "commit": {
          "type": "string",
          "pattern": "^[0-9a-f]{40}$",
          "description": "Full 40-char git commit SHA-1 that was audited. Never a branch name — a branch moves and makes the record meaningless."
        },
        "subpath": {
          "type": "string",
          "description": "Optional path within the repo that scopes the audit, e.g. 'shared/'."
        },
        "release_tag": {
          "type": "string",
          "description": "Optional human-facing release anchor, e.g. 'v5.6.0'."
        }
      }
    },
    "run": {
      "type": "object",
      "additionalProperties": false,
      "required": ["date", "model", "harness", "prompts_ref", "scope"],
      "properties": {
        "date": {
          "type": "string",
          "format": "date",
          "description": "UTC date the run was performed (YYYY-MM-DD)."
        },
        "model": {
          "type": "string",
          "description": "Exact model identifier used, e.g. 'claude-opus-4-8', 'gpt-5', 'gemini-3-pro', 'local:qwen3-coder-480b'. Never a marketing name."
        },
        "harness": {
          "type": "string",
          "description": "Tool/agent that drove the model, incl. version, e.g. 'claude-code v3.1', 'manual-chat', 'custom-script'."
        },
        "prompts_ref": {
          "type": "string",
          "description": "Repo-relative path to the exact prompt pack used, under prompts/. Enables re-running the audit."
        },
        "transcript_sha256": {
          "type": "string",
          "pattern": "^[0-9a-f]{64}$",
          "description": "SHA-256 of the full run transcript. The transcript itself lives under transcripts/ or in an external artifact store referenced by transcript_uri."
        },
        "transcript_uri": {
          "type": "string",
          "description": "Optional location of the full transcript when too large to store in-repo (repo-relative path, https URL, ipfs://, or magnet:)."
        },
        "scope": {
          "type": "string",
          "description": "What was and was NOT covered by this run. Required — an audit with unstated scope is not interpretable."
        },
        "duration_minutes": {
          "type": "number",
          "minimum": 0,
          "description": "Optional wall-clock minutes for the run."
        },
        "cost_estimate_usd": {
          "type": "number",
          "minimum": 0,
          "description": "Optional estimated model cost in USD."
        },
        "runs_count": {
          "type": "integer",
          "minimum": 1,
          "description": "Optional number of independent repetitions this attestation aggregates. LLM runs are non-deterministic; >1 strengthens signal."
        }
      }
    },
    "findings": {
      "type": "array",
      "description": "Zero or more findings. An empty array is invalid; a run that surfaced nothing MUST contain exactly one finding with severity 'none-found'.",
      "minItems": 1,
      "items": {
        "type": "object",
        "additionalProperties": false,
        "required": ["ref", "severity", "status", "summary"],
        "properties": {
          "ref": {
            "type": "string",
            "pattern": "^OSC-[0-9]{4}-[0-9]{4,}-F[0-9]+$",
            "description": "Finding reference, e.g. OSC-2026-0001-F1."
          },
          "severity": {
            "enum": ["critical", "high", "medium", "low", "info", "none-found"],
            "description": "Severity of the finding. 'none-found' is a first-class result meaning the run reported nothing in scope."
          },
          "status": {
            "enum": ["validated", "false-positive", "disputed", "unreviewed", "withheld-pending-disclosure"],
            "description": "Human-triage status. Raw model output is 'unreviewed'; only a named validator may set 'validated'. Medium+ findings in live software use 'withheld-pending-disclosure' with the body redacted until disclosure."
          },
          "summary": {
            "type": "string",
            "description": "Short human-readable statement of the finding. Redacted to a placeholder when status is 'withheld-pending-disclosure'."
          },
          "location": {
            "type": "string",
            "description": "Optional file:line or symbol where the finding sits."
          },
          "cwe": {
            "type": "string",
            "pattern": "^CWE-[0-9]+$",
            "description": "Optional CWE identifier."
          },
          "body_sha256": {
            "type": "string",
            "pattern": "^[0-9a-f]{64}$",
            "description": "For withheld findings: SHA-256 of the full finding text. Commits the auditor to content + timestamp without revealing it (provable priority, no leak)."
          },
          "validator": {
            "type": "string",
            "description": "Identifier of the human who set 'status'. Required for 'validated' or 'false-positive'."
          },
          "validator_notes": {
            "type": "string",
            "description": "How the finding was reproduced or refuted."
          },
          "disclosure": {
            "type": "object",
            "additionalProperties": false,
            "description": "Disclosure-tracking metadata for withheld findings.",
            "properties": {
              "reported_to": { "type": "string", "description": "Security contact the finding was reported to." },
              "reported_date": { "type": "string", "format": "date" },
              "embargo_until": { "type": "string", "format": "date", "description": "Earliest date the body may be published." }
            }
          }
        }
      }
    },
    "verdict": {
      "enum": ["findings-validated", "clean-run", "inconclusive"],
      "description": "Run-level conclusion. 'clean-run' = ran to completion in scope, nothing found. This is NOT 'the code is safe' — a clean AI run can and does miss real bugs (see Coldcard, 2026)."
    },
    "auditor": {
      "type": "object",
      "additionalProperties": false,
      "required": ["id", "name"],
      "properties": {
        "id": {
          "type": "string",
          "pattern": "^[a-z0-9][a-z0-9-]*$",
          "description": "Stable auditor slug matching a file under auditors/<id>.json."
        },
        "name": { "type": "string" },
        "npub": {
          "type": "string",
          "pattern": "^npub1[a-z0-9]+$",
          "description": "Optional Nostr public key (secp256k1)."
        },
        "contact": { "type": "string", "description": "Optional contact for disclosure coordination." }
      }
    },
    "signature": {
      "type": "object",
      "additionalProperties": false,
      "required": ["alg", "principal", "value"],
      "description": "Detached signature over the payload 'osc-attestation/v0\\n' + RFC-8785-canonical JSON of this object with 'signature' removed. Any of three schemes; the signing key must be registered under auditors/<id>.json.",
      "properties": {
        "alg": {
          "enum": ["nostr-schnorr", "ssh-ed25519", "pgp"],
          "description": "Signature scheme: nostr-schnorr (BIP-340/secp256k1, principal=npub), ssh-ed25519 (OpenSSH sig, principal=identity), or pgp (OpenPGP detached sig, principal=key fingerprint)."
        },
        "principal": {
          "type": "string",
          "description": "Signer identity: an npub (nostr), an SSH principal string (ssh), or a hex key fingerprint/long-id (pgp)."
        },
        "value": {
          "type": "string",
          "description": "The signature: 128-hex (nostr schnorr), an armored SSHSIG block (ssh), or an armored PGP signature block (pgp)."
        }
      },
      "allOf": [
        { "if": { "properties": { "alg": { "const": "nostr-schnorr" } } },
          "then": { "properties": { "principal": { "type": "string", "pattern": "^npub1[a-z0-9]{58,}$" }, "value": { "type": "string", "pattern": "^([0-9a-f]{128}|PENDING___sign)$", "description": "128-hex BIP-340 schnorr signature, or the literal PENDING___sign for intentionally unsigned draft records (must not use all-zero hex, which looks signed)." } } } },
        { "if": { "properties": { "alg": { "const": "ssh-ed25519" } } },
          "then": { "properties": { "value": { "type": "string", "pattern": "BEGIN SSH SIGNATURE" } } } },
        { "if": { "properties": { "alg": { "const": "pgp" } } },
          "then": { "properties": { "principal": { "type": "string", "pattern": "^[0-9A-Fa-f]{16,40}$" }, "value": { "type": "string", "pattern": "BEGIN PGP SIGNATURE" } } } }
      ]
    }
  }
}
